<?xml version="1.0" encoding="UTF-8"?>
<validation xmlns="http://www.fun90.com/schema/fun-validation"
            xmlns:xsi="http://www.w3.org/2001/XMLSchema-instance"
            xsi:schemaLocation="http://www.fun90.com/schema/fun-validation http://www.fun90.com/schema/fun-validation/fun-validation-1.0.xsd">

    <group id="user.validate2">
        <!-- 验证字段 -->
        <field name="email">
            <!-- 规则列表 -->
            <rule ref="email2"/>
            <rule name="required" message="邮件必须填写"/>
        </field>

        <field name="id">
            <rule name="match" message="用户ID已被使用">
                <param name="regex" value="^100\d*$"/>
            </rule>
        </field>

        <field name="username">
            <rule name="custom" message="非法的用户名">
                <param name="value" value="admin"/>
            </rule>
        </field>

        <field name="password">
            <rule name="required" message="密码必须填写"/>
            <rule name="min" message="密码至少5个字符">
                <param name="value" value="5"/>
            </rule>
            <rule name="max" message="密码最多20个字符">
                <param name="value" value="20"/>
            </rule>
            <rule name="equals" message="两次密码输入不正确">
                <param name="target" value="passwordOne"/>
            </rule>
        </field>
        <field name="starttime">
            <rule name="timestampLessEqual" message="开始时间不能大于结束时间">
                <param name="target" value="endtime"/>
            </rule>
        </field>
        <field name="endtime">
            <rule name="timestampGreaterEqual" message="结束时间不能小于开始时间">
                <param name="target" value="starttime"/>
            </rule>
        </field>
    </group>
</validation>