<?xml version="1.0" encoding="UTF-8"?>
<validation xmlns="http://www.fun90.com/schema/fun-validation"
            xmlns:xsi="http://www.w3.org/2001/XMLSchema-instance"
            xsi:schemaLocation="http://www.fun90.com/schema/fun-validation http://www.fun90.com/schema/fun-validation/fun-validation-1.0.xsd">
    <validator name="required" class="com.fun90.validation.validators.RequiredValidator"/>
    <validator name="match" class="com.fun90.validation.validators.MatchValidator"/>
    <validator name="between" class="com.fun90.validation.validators.BetweenValidator"/>
    <validator name="min" class="com.fun90.validation.validators.MinValidator"/>
    <validator name="max" class="com.fun90.validation.validators.MaxValidator"/>
    <validator name="equals" class="com.fun90.validation.validators.EqualsValidator"/>
    <validator name="timestampLessEqual"
               class="com.fun90.validation.validators.TimestampLessEqualValidator"/>
    <validator name="timestampGreaterEqual"
               class="com.fun90.validation.validators.TimestampCreaterEqualValidator"/>

    <properties>
        <property name="checkAll" value="true"/>
    </properties>

</validation>